{
  "schema_version": "2.0.0",
  "firmware": {
    "name": [
      {
        "lang": "en",
        "text": "Snapshot PB autococker firmware"
      }
    ],
    "version": "26.29.0",
    "protocol_version": "1.0.0",
    "board_models": [
      "BOARD_MODEL_AUTOCOCKER"
    ],
    "summary": [
      {
        "lang": "en",
        "text": "The firmware of the Snapshot PB autococker board. This example covers the root screen, the Fire screen, the Ramping screen, and the Eye screen."
      }
    ],
    "media": [
      "buttons"
    ]
  },
  "controls": {
    "enter": {
      "name": [
        {
          "lang": "en",
          "text": "ENTER"
        }
      ],
      "description": [
        {
          "lang": "en",
          "text": "The centre button. It selects a row, commits a value, and opens the menu."
        }
      ],
      "events": {
        "short": {
          "description": [
            {
              "lang": "en",
              "text": "A press and a release in less than the hold time."
            }
          ]
        },
        "long": {
          "description": [
            {
              "lang": "en",
              "text": "A press that lasts the hold time or longer."
            }
          ],
          "hold_ms": 1500
        }
      }
    },
    "up": {
      "name": [
        {
          "lang": "en",
          "text": "UP"
        }
      ],
      "description": [
        {
          "lang": "en",
          "text": "The top button. It moves the cursor up and increases a value."
        }
      ],
      "events": {
        "short": {
          "description": [
            {
              "lang": "en",
              "text": "A press and a release in less than the hold time."
            }
          ]
        },
        "long": {
          "description": [
            {
              "lang": "en",
              "text": "A press that lasts the hold time or longer."
            }
          ],
          "hold_ms": 1500
        }
      }
    },
    "down": {
      "name": [
        {
          "lang": "en",
          "text": "DOWN"
        }
      ],
      "description": [
        {
          "lang": "en",
          "text": "The bottom button. It moves the cursor down and decreases a value."
        }
      ],
      "events": {
        "short": {
          "description": [
            {
              "lang": "en",
              "text": "A press."
            }
          ]
        }
      }
    },
    "lockout": {
      "name": [
        {
          "lang": "en",
          "text": "LOCKOUT"
        }
      ],
      "description": [
        {
          "lang": "en",
          "text": "The lockout button. It locks and unlocks the settings."
        }
      ],
      "events": {
        "short": {
          "description": [
            {
              "lang": "en",
              "text": "A press."
            }
          ]
        }
      }
    }
  },
  "interactions": {
    "open_menu": {
      "control": "enter",
      "event": "short",
      "description": [
        {
          "lang": "en",
          "text": "Opens the root menu from the home screen."
        }
      ],
      "applies_to": [
        "home"
      ]
    },
    "cursor_up": {
      "control": "up",
      "event": "short",
      "description": [
        {
          "lang": "en",
          "text": "Moves the cursor one row up. On the first row, it stays."
        }
      ],
      "applies_to": [
        "screen"
      ]
    },
    "cursor_down": {
      "control": "down",
      "event": "short",
      "description": [
        {
          "lang": "en",
          "text": "Moves the cursor one row down. On the last row, it stays."
        }
      ],
      "applies_to": [
        "screen"
      ]
    },
    "select": {
      "control": "enter",
      "event": "short",
      "description": [
        {
          "lang": "en",
          "text": "Opens the row under the cursor. A submenu row opens its screen. A setting row opens its editor. A toggle row changes its value at once."
        }
      ],
      "applies_to": [
        "screen"
      ]
    },
    "back": {
      "control": "enter",
      "event": "short",
      "description": [
        {
          "lang": "en",
          "text": "On the Back row, returns to the parent screen. On the root screen, returns to the home screen."
        }
      ],
      "applies_to": [
        "screen"
      ]
    },
    "value_up": {
      "control": "up",
      "event": "short",
      "description": [
        {
          "lang": "en",
          "text": "In an editor, increases the value by one step, or moves to the next option. The value stops at the maximum."
        }
      ],
      "applies_to": [
        "edit_int",
        "edit_enum"
      ]
    },
    "value_down": {
      "control": "down",
      "event": "short",
      "description": [
        {
          "lang": "en",
          "text": "In an editor, decreases the value by one step, or moves to the previous option. The value stops at the minimum."
        }
      ],
      "applies_to": [
        "edit_int",
        "edit_enum"
      ]
    },
    "commit": {
      "control": "enter",
      "event": "short",
      "description": [
        {
          "lang": "en",
          "text": "In an editor, stores the value and returns to the screen. An editor has no cancel."
        }
      ],
      "applies_to": [
        "edit_int",
        "edit_enum"
      ]
    },
    "power_off": {
      "control": "enter",
      "event": "long",
      "description": [
        {
          "lang": "en",
          "text": "Turns the board off from each screen that takes input."
        }
      ]
    },
    "eye_override": {
      "control": "up",
      "event": "long",
      "description": [
        {
          "lang": "en",
          "text": "Turns the eyes off or on for this session. The stored eye mode does not change."
        }
      ],
      "applies_to": [
        "home"
      ]
    },
    "lockout_toggle": {
      "control": "lockout",
      "event": "short",
      "description": [
        {
          "lang": "en",
          "text": "Locks or unlocks the settings. While locked, the board shows the shot counter only."
        }
      ]
    }
  },
  "home": {
    "title": [
      {
        "lang": "en",
        "text": "Shot counter"
      }
    ],
    "description": [
      {
        "lang": "en",
        "text": "The screen that the board shows after the boot caption. It shows the shot count and the state marks. The menu opens from this screen."
      }
    ],
    "indicators": {
      "bluetooth": [
        {
          "lang": "en",
          "text": "The Bluetooth mark shows while the Bluetooth radio is on."
        }
      ],
      "eyes": [
        {
          "lang": "en",
          "text": "The eye mark shows the eye state: on, off, or overridden for this session."
        }
      ]
    }
  },
  "root": "root",
  "screens": {
    "root": {
      "title": [
        {
          "lang": "en",
          "text": "Menu"
        }
      ],
      "description": [
        {
          "lang": "en",
          "text": "The first screen of the menu. The two rows at the top select how the whole board looks. The submenu rows below them hold the settings of one subject each."
        }
      ],
      "items": [
        {
          "type": "setting",
          "render": [
            {
              "lang": "en",
              "text": "Profile"
            }
          ],
          "key": "device_config.active_profile"
        },
        {
          "type": "submenu",
          "render": [
            {
              "lang": "en",
              "text": "Fire"
            }
          ],
          "ref": "fire_menu"
        },
        {
          "type": "submenu",
          "render": [
            {
              "lang": "en",
              "text": "Eye"
            }
          ],
          "ref": "eye_menu"
        },
        {
          "type": "setting",
          "render": [
            {
              "lang": "en",
              "text": "Bluetooth"
            }
          ],
          "key": "runtime.bluetooth_active"
        },
        {
          "type": "back",
          "render": [
            {
              "lang": "en",
              "text": "Back"
            }
          ]
        }
      ]
    },
    "fire_menu": {
      "title": [
        {
          "lang": "en",
          "text": "Fire"
        }
      ],
      "items": [
        {
          "type": "setting",
          "render": [
            {
              "lang": "en",
              "text": "Mode"
            }
          ],
          "key": "autococker.fire_mode"
        },
        {
          "type": "setting",
          "render": [
            {
              "lang": "en",
              "text": "BPS cap"
            }
          ],
          "key": "profile.fire_rate_cap"
        },
        {
          "type": "submenu",
          "render": [
            {
              "lang": "en",
              "text": "Ramping"
            }
          ],
          "ref": "ramp_menu",
          "hidden_when": "ramping_off"
        },
        {
          "type": "back",
          "render": [
            {
              "lang": "en",
              "text": "Back"
            }
          ]
        }
      ]
    },
    "ramp_menu": {
      "title": [
        {
          "lang": "en",
          "text": "Ramping"
        }
      ],
      "items": [
        {
          "type": "setting",
          "render": [
            {
              "lang": "en",
              "text": "Multiplier"
            }
          ],
          "key": "autococker.ramping_custom_multiplier",
          "disabled_when": "ramping_off"
        },
        {
          "type": "back",
          "render": [
            {
              "lang": "en",
              "text": "Back"
            }
          ]
        }
      ]
    },
    "eye_menu": {
      "title": [
        {
          "lang": "en",
          "text": "Eye"
        }
      ],